{
  "freeze_note": "Named rubric/evaluator/helper closure only; each native trial records its own prepared public-source snapshot hash.",
  "frozen_files": {
    ".github/scripts/validate_agent_docs.py": "e7fc757932c2e28501c5f8c7dd7c4fb4bef340afe49ac273b8ac220c87c71195",
    ".github/scripts/validation/__init__.py": "21cb0b53d94f3d72f3809483fd5050de2175773c20aad17ed72311c3b3a6ef86",
    ".github/scripts/validation/anchors.py": "f5c78a1fb203b1e461d4dec1e9ffeb195f4608aa22d01fc816bb7bb586e2ec26",
    ".github/scripts/validation/baselines.py": "259a87b1684b8333c2bdbe9a91d8b99fc9f24873aa9248a2b5ea4314cb50b90d",
    ".github/scripts/validation/campaign.py": "0223782b9ab418c95bf34238ea7a647c9ed065dcd0c7e1cfdb1075e9368b8a0a",
    ".github/scripts/validation/common.py": "72a591d6f935d8dbf12602e31bb836fb3243e3fd2cb5d14a4eab8ce015dfc174",
    ".github/scripts/validation/compatibility.py": "f3c1a3b9b6a67bf26996926fd1e5c458e072a03c3a084ccc2ce56fcc8aff138c",
    ".github/scripts/validation/controls.py": "c75d59f7987c2312c32e3ccd74bd8262c01256fc610902839de79240b34e90f2",
    ".github/scripts/validation/entrypoints.py": "5485b80b92b4b45c634e871f8d35dccd920936f3f9fea0369a6361ccd4866f2e",
    ".github/scripts/validation/evals.py": "1c1a8a603bf1929751fc9800770c86968275f6a53a3b4e15fe32b894c4ba7026",
    ".github/scripts/validation/executables.py": "902074f8e176db14d00fd20df44bc1c850915bac5ef874939e6720fc0ec28734",
    ".github/scripts/validation/first_read.py": "cf6574e82b69bd9f7e2d92a1783050e1b3c8e0b8fce2aed02a794f0f2eaf203c",
    ".github/scripts/validation/guidance.py": "1635aadc769d24a0764f3aacc95511a5537cc699f8d685a40faa6915a57470cb",
    ".github/scripts/validation/opportunities.py": "b332bb038259d3f02dae0071407677a6093711c7693edac52838c0257c481f01",
    ".github/scripts/validation/protocol.py": "3076bc5de219043ecc5bac7d1347bab92c7ff5dc9cec33b09c6ba1796fda8f1b",
    ".github/scripts/validation/records.py": "f8fbbd94efffcd83e3186fd60497de74dd85ecba73d3cf8f4eb9fd16e8ab9793",
    ".github/scripts/validation/registry.py": "6bdcd827979dfed03ca32dc05f547de61e987a65b5fe239ae257b6fb7a763e52",
    ".github/scripts/validation/resources.py": "17479dc09f15d87f87a0d5357931d05d89959faeff18683b5a86a5996546d0ce",
    ".github/scripts/validation/selftest.py": "e94373186420a336302c1638acf15af1f7196cd64d92a731e240ad69825cdcca",
    ".github/scripts/validation/state_machine.py": "7abb756a6e8847a5800e58fd56d8beb240897929ede5e967ddeb5bdc6b46a136",
    "AGENTS.md": "9f970c943ac438c7cd3e0a85623f30ff306cb123d59573c93dd92faea436bad9",
    "CLAUDE.md": "7e328ef61b22d47b8dd81128eb7c56c462db10ec5baed215eb374da36f6c1062",
    "CONTRIBUTING.md": "6bea3414a00b5293bc606266c3d57337659d6fcf7ca517992662881391edc70d",
    "README.md": "232572febec9e788b3a03b82f56a475a775028811e58ce34630fc99b89aa51cc",
    "docs/agents/background-agent.md": "4d601c7e9e2f01730d5e8a25da2556ba115477d4c53795bc2c4bcbd327adddcb",
    "docs/agents/diagnostics.md": "35b756ac951dde47b6cf372d989a6568eb08604f713b4abb4eb60d9221e4f88f",
    "docs/agents/first-contribution.md": "28e09528ae8bbe12df74d17953e1792f5d490ad4da97d466b261580e55ba208d",
    "docs/agents/first-search.md": "e8a8bd9dc95145d08999a8488f498a4cfeb7e710a31318720c09eb379759674b",
    "docs/agents/harness-verification.md": "64fc88a1e34b60dc091bb0d34d2532a6b0b995cafaeff559e9c0a4ae39b8ba27",
    "docs/agents/install-authenticate.md": "bf4989480e59339b703a5662c0b6de3bada69ef71662eb6452452263ed56c434",
    "docs/agents/quickstart.md": "1350e9e5438cc2a47dbac85acfb68528c77a5b89a6451c4120053a0284c3d379",
    "docs/agents/references/compatibility.json": "e34eb8c8b2533e07b67e014d7c1995e0c7e4237d9928c41e8deae782b9328c2f",
    "docs/agents/references/onboarding.json": "434eb7be6f4f509e9782b2c225e315fdac5e97149c5a45ae33662765fb4e0193",
    "docs/agents/research-campaign.md": "c074e9724e43a0dcfad4d1e94a2dede723cd5238f3342b0858358d3ec3bbe3bd",
    "docs/agents/research-opportunities.json": "725f26696652a2439f1f27b1fd1f979d3a8ac48bbc57d6911718d288dd564eba",
    "docs/agents/research-opportunities.md": "3326ddf88cfde28f9adb7a1c04c20687b58777473cc935fb4320516472115321",
    "docs/agents/research-security.md": "29258e4126736b2e3d82cb771869ac8169a2bb32ba9873d69890a23fa35249ca",
    "docs/agents/start-here.md": "f62302df9d50e324efe55b57cfcfa443f866ac052168eedd1d27545bc07fd5f7",
    "docs/start-here/onboard-your-agent.md": "272e9228393799a92f41395e34fd3978739741df822ff7954bdd6000dd1b4dba",
    "examples/agent-campaign/campaign.json": "340650cc3b4d5953ee139504de2af4d56650a4848eead0272a5a7480a338275d",
    "examples/agent-campaign/challenger_design.md": "bddde3cded55bb97f4a17130ec5c28d07528c9f97ce4e86a19f751bdf9745147",
    "examples/agent-campaign/coverage_challenger.py": "e4a6d3b6c0216eda87fa306a69662fd7e467a26a7c8ced929188eabc0c9414ad",
    "examples/agent-campaign/stratified_policy.py": "0cd41f0991257ad43a1e64b42755e8fc2e972573f35f58bef9a92520a1efe079",
    "examples/background-agent/README.md": "b27fdfa6e3d6d00d74d17d057a9775b7f6aa24f3eeb98ad0d5eeed7b561ddf23",
    "examples/background-agent/adapter-interface.md": "ab3ccf4e86dd9274e9cdb120bd6c03d7f0bb494d83371335137409acaf6fa598",
    "examples/background-agent/conformance.py": "dab3717d0218cdfa318e4c81ca8fd20bac417426fb4d7e789ca34a25ada224c1",
    "examples/background-agent/conformance.schema.json": "b1c842611a71e3c8e52c26e12463a005383795eef6ad7716dca9d040ec004503",
    "examples/background-agent/contributor-reliability-wave-20260924/background-codex-1.json": "a09c09cd4f5f0e7ec48118e1cdaa782202698612cb2b5184fbe050c086daa1e8",
    "examples/background-agent/contributor-reliability-wave-20260924/background-opencode-2.json": "6ca3e39beae1bf5b8ee1fdbc0298b625ff6009a31615bf39b1b70cfacb36ad43",
    "examples/background-agent/fixtures/README.md": "6bd2d81ca2f93f9ecf6a6c59e0bf4bfac12e12d8c80f0b4e23921815ed643f18",
    "examples/background-agent/fixtures/claude-code-stream.synthetic.jsonl": "8bf7c9e2ff13a321da14a8b9ddbe4b30f6e264a70fd2c549c8e093ccca247d0e",
    "examples/background-agent/fixtures/conformance-pass.synthetic.json": "70e56b8c27b2c49ebfefaa69e814d77d763fd5d9451307d9022bdcb03a8e93f6",
    "examples/background-agent/fixtures/proof-v2-envelope.synthetic.json": "e3746ea2d90f068e16c14302946ca15a84b3775ef1e0311aada2090e855252d3",
    "examples/background-agent/native-contribution-wave-20260924/codex-proof.json": "8c0c31ca30f179ac82584df5405bf18fcb7acbf72c506b6d92498a955e3ff28a",
    "examples/background-agent/native-contribution-wave-20260924/opencode-proof.json": "265b35dd9b3685fdcdb9f6358d76a4134a56856570bc3b845f33b1f6435eb353",
    "examples/background-agent/proof.py": "ce2d0031c25a110c04aaabe54c9763e732fedf402bbe4ac2c01aa00a9a2e13c0",
    "examples/background-agent/proof.schema.json": "4682d20782f236a9c615864453b8c80ddba645a14e03278d633eff45c254a6f9",
    "examples/fresh-agent-evals/README.md": "848d2b073bec1ae1eb67830c0050e1e87cf610f41ceb2e4f5f2548b78db89ba2",
    "examples/fresh-agent-evals/discovery_checks.py": "8db0271a7fc8261ea39aa45e2f5117559455ed41a08ce72aade6be295ce29b01",
    "examples/fresh-agent-evals/fixtures/challenger-research/trial-inputs/primary-source-excerpt.md": "08ecc9767bf0f37055bbda96999dc97c80a86918038ef3ca833b5b3367bd7373",
    "examples/fresh-agent-evals/research/README.md": "afac10677258f7259d4ae3ffbd2b49e8d73c648fe29088463ea0976b7714bc38",
    "examples/fresh-agent-evals/research/callback-contract.md": "cfaa4615993ed9f69af1b9326a3a5f17106f374fb929c64e917b41de48e797ff",
    "examples/fresh-agent-evals/research/callback_worker.py": "1d0b26b5028f29ced292450839d763e93c9ca9c3577bc02c3c7561a52912e74a",
    "examples/fresh-agent-evals/research/comparison-report.schema.json": "c5aacc88af9105e0436f454eaed7a43f954bc0ecf02e90f9610a0ae0f92ae9a6",
    "examples/fresh-agent-evals/research/contract.py": "01c26dbeaf56e428da2cbc33a210bb7543fb74f346938f7c6db8c9dac9a69510",
    "examples/fresh-agent-evals/research/fixture.json": "6baefe26ad0c14a741de14da835d7439d40ab891a6119381a3f89c4acfbd1b4f",
    "examples/fresh-agent-evals/research/fixture.schema.json": "0c9bb8b390d3124ef2e111cca0f2c26079e8608fc73e32dd6ab245367f730c81",
    "examples/fresh-agent-evals/research/research-result.schema.json": "f1df5f12f295c2002dbc5e394635d043bbf551d2188e0c4b6e5a912d4bca954e",
    "examples/fresh-agent-evals/research/research_access.py": "e295de7ae86cebb98b3ac14058815362b28adc80f859418ca7c0602f5e691417",
    "examples/fresh-agent-evals/research/research_grader.py": "d650ef8382efad0a959782152587b7524f68f16071258fc72425c7462892d363",
    "examples/fresh-agent-evals/research/research_selfcheck.py": "6420ff9f45dd281b9f87d5e0d9ea41c2d1a7ee5cef6dbfb56cf2f0f229538f22",
    "examples/fresh-agent-evals/research/runner.py": "46acb2ee8b6dddf42e94e4e75b13862c3c2e5f3edd46551432fe10e30c07fd45",
    "examples/fresh-agent-evals/research/series.py": "13a30e090002c59b6affbb05b7d12d42d4af39d13e647b48616e24714db40135",
    "examples/fresh-agent-evals/research/series.schema.json": "5da1889f5a9202692b578808117942f51e2ff6c595a187918fca6d36f191843c",
    "examples/fresh-agent-evals/research/source-provenance.json": "df5aed2df10659c60e3fb8c43ef5fbf57dc659e5ea4d8daea4feed3069f9060a",
    "examples/fresh-agent-evals/research/synthetic_evaluator.py": "a1865f9bc0917ae421c90da9afab3dc626478207946859eae07c2b1c18a441a8",
    "examples/fresh-agent-evals/research/task.md": "e780426f3e81b986944380de5e8a583464ee01ff6f0aa1b7062a4d4927ee3462",
    "examples/fresh-agent-evals/research/trial-record.schema.json": "6bcd77c6ac058f75e15e5427741e0e96bfe85604db64c8e60eee94acf96a2279",
    "examples/fresh-agent-evals/research/typed_schemas.py": "6396bd3651c0a14837c971398fb4dbf39e690b21133334b2e476d5528cd39424",
    "examples/fresh-agent-evals/research/verdict.schema.json": "8538af18ce873d74f14865732b491f8f92568e0cfc39916bea32e8262de7907b",
    "examples/fresh-agent-evals/tool_outcomes.py": "a7e2620dc6f923c7e62f31df8e1104d491c897b952cf9968a2b160ccc35334de",